{
  "schemaVersion": "0.2.0",
  "frozen": true,
  "nodes": [
    {
      "index": 0,
      "id": "guides/intro",
      "sourcePath": "guides/intro.md",
      "role": "trunk",
      "parent": null,
      "parentIndex": null,
      "title": "Introduction",
      "status": "published",
      "tags": ["guide", "intro"],
      "bodyOffset": 67
    },
    {
      "index": 1,
      "id": "guides/intro-tips",
      "sourcePath": "guides/intro-tips.md",
      "role": "satellite",
      "parent": "guides/intro",
      "parentIndex": 0,
      "title": "Intro Tips",
      "status": "draft",
      "tags": ["guide", "tips"],
      "bodyOffset": 81
    },
    {
      "index": 2,
      "id": "index",
      "sourcePath": "index.md",
      "role": "trunk",
      "parent": null,
      "parentIndex": null,
      "title": "Home",
      "status": "published",
      "tags": ["home"],
      "bodyOffset": 51
    }
  ],
  "edges": [
    {
      "from": {
        "type": "page",
        "value": "guides/intro-tips"
      },
      "to": {
        "type": "page",
        "value": "guides/intro"
      },
      "kind": "parent"
    }
  ],
  "reverseIndex": [
    {
      "target": {
        "type": "page",
        "value": "guides/intro"
      },
      "incomingEdges": [0]
    }
  ],
  "nav": [
    {
      "index": 0,
      "id": "guides/intro",
      "breadcrumb": [0],
      "children": [1],
      "siblings": []
    },
    {
      "index": 1,
      "id": "guides/intro-tips",
      "breadcrumb": [0, 1],
      "children": [],
      "siblings": []
    },
    {
      "index": 2,
      "id": "index",
      "breadcrumb": [2],
      "children": [],
      "siblings": []
    }
  ]
}
