{
  "schemaVersion": "0.2.0",
  "frozen": true,
  "nodes": [
    {
      "index": 0,
      "id": "empty-no-fm",
      "sourcePath": "empty-no-fm.md",
      "role": "trunk",
      "parent": null,
      "parentIndex": null,
      "title": null,
      "status": null,
      "tags": [],
      "bodyOffset": 0
    },
    {
      "index": 1,
      "id": "home",
      "sourcePath": "trunk-root.md",
      "role": "trunk",
      "parent": null,
      "parentIndex": null,
      "title": "Home Trunk",
      "status": "published",
      "tags": ["home"],
      "bodyOffset": 66
    },
    {
      "index": 2,
      "id": "nested/deep/page",
      "sourcePath": "nested/deep/page.md",
      "role": "trunk",
      "parent": null,
      "parentIndex": null,
      "title": "Nested Deep Page",
      "status": "published",
      "tags": [],
      "bodyOffset": 50
    },
    {
      "index": 3,
      "id": "satellite-child",
      "sourcePath": "satellite-child.md",
      "role": "satellite",
      "parent": "home",
      "parentIndex": 1,
      "title": "Child Satellite",
      "status": "draft",
      "tags": ["satellite"],
      "bodyOffset": 76
    }
  ],
  "edges": [
    {
      "from": {
        "type": "page",
        "value": "satellite-child"
      },
      "to": {
        "type": "page",
        "value": "home"
      },
      "kind": "parent"
    }
  ],
  "reverseIndex": [
    {
      "target": {
        "type": "page",
        "value": "home"
      },
      "incomingEdges": [0]
    }
  ],
  "nav": [
    {
      "index": 0,
      "id": "empty-no-fm",
      "breadcrumb": [0],
      "children": [],
      "siblings": []
    },
    {
      "index": 1,
      "id": "home",
      "breadcrumb": [1],
      "children": [3],
      "siblings": []
    },
    {
      "index": 2,
      "id": "nested/deep/page",
      "breadcrumb": [2],
      "children": [],
      "siblings": []
    },
    {
      "index": 3,
      "id": "satellite-child",
      "breadcrumb": [1, 3],
      "children": [],
      "siblings": []
    }
  ]
}
